{
  "id": "program-001",
  "tenant_id": "tenant-alpha",
  "portfolio_id": "portfolio-001",
  "name": "Cloud Modernization",
  "status": "active",
  "owner": "program.lead@ppm.example",
  "classification": "confidential",
  "created_at": "2024-02-01T08:00:00Z",
  "updated_at": "2024-03-01T10:00:00Z"
}
